{"protocolVersion":"1.0","resultIdentity":"test-only-result-1","resultVersion":1,"jobId":"33333333-3333-4333-8333-333333333333","agentId":"11111111-1111-4111-8111-111111111111","moduleId":"mock.safe","status":"SUCCEEDED","startedAt":"2026-08-11T12:00:01Z","completedAt":"2026-08-11T12:00:02Z","summary":"Synthetic success","observations":[],"metrics":[],"warnings":[],"evidenceManifest":[],"truncated":false}
